error_id,stage,error_code,severity,item_id,detected_at,detected_by,description,root_cause,corrective_action,fix_commit,retest_result,closed_at,status
ERR-0001,P0,X-01,moderate,python_environment,2026-07-10T02:05:04Z,codex,"bundled Python unittest import failed: ModuleNotFoundError: No module named 'requests'","repo requirements are not installed in a locked research environment","create isolated locked environment and rerun Python tests",,"9 Python tests passed under Python 3.12.13 locked environment",2026-07-10T02:21:34Z,closed
ERR-0002,P0,X-02,moderate,src/generated/literature-candidates.json,2026-07-10T02:05:06Z,codex,"npm test rewrote generatedAt with current time despite unchanged inputs","generator embeds wall-clock time in tracked output","derive generatedAt from latest source search_date",,"deterministic generation test passed across two consecutive runs",2026-07-10T02:21:34Z,closed
ERR-0003,P0,X-04,moderate,RIS_JF,2026-07-10T02:18:00Z,codex,"RIS JF journal name was empty after rispy parsing","rispy 0.10.0 maps JF to alternate_title3 but adapter did not read that key","add alternate_title3 after higher-priority normalized journal keys",,"RIS parser regression passed; full Python suite 9 passed",2026-07-10T02:21:34Z,closed
ERR-0004,P0,X-05,low,reference_manifest,2026-07-10T02:22:00Z,codex,"Gate 0 flagged the Google Drive parent folder name 여형준님 in source provenance","raw substring scan did not distinguish provenance paths from active research content","exclude the exact reference provenance manifest while retaining active app/data marker tests",,"three identity tests passed and actual Gate 0 passed",2026-07-10T02:23:10Z,closed
ERR-0005,P1,S-06,critical,pubmed_adapter,2026-07-10T02:00:00Z,codex,"legacy PubMed runs stored only 50 or 100 records from larger hit sets","adapter defaulted to a fixed max_records value and did not reconcile hit export and import counts","make full retrieval the default; fail above PubMed 10000 UID limit; record reconciliation fields",,"six search pipeline tests passed including full retrieval and over-limit failure",2026-07-10T02:35:00Z,closed
ERR-0006,P0,X-03,high,src/generated/literature-candidates.json,2026-07-10T07:19:00Z,codex,"Gate 0 found a Yeo study label after generation through the workspace junction","generator inferred study identity from the current working directory name","read research_v2/project_identity.json and fail closed for non-Kwon identity; add generated identity regression test",,"two targeted generation tests passed; Gate 0 passed; full Python suite 13 passed",2026-07-10T10:43:00Z,closed
ERR-0007,P1,X-05,low,release_validator_reference_provenance,2026-07-10T10:44:00Z,codex,"release validator flagged 여형준님 in the immutable source path stored by reference_manifest.json","release identity scan lacked the narrow provenance exception already used by Gate 0","exclude only protocol/reference/reference_manifest.json and retain active-file marker detection",,"two release-validator identity tests passed; preflight output contains no yeo_marker failure",2026-07-10T10:45:00Z,closed
