record_id,source,target_id,search_run_id,title,abstract_or_summary,year,journal_or_source,doi,pmid,url,raw_record_id,dedup_key,duplicate_of,is_duplicate
pubmed:24593783:pubmed_K2_2026-07-10_cd801112,pubmed,K2,pubmed_K2_2026-07-10_cd801112,"Pyridoxal-5'-phosphate (MC-1), a vitamin B6 derivative, inhibits expressed P2X receptors.","P2X receptors are cation-permeable ligand-gated ion channels that open in response to the binding of ATP. These receptors are present in many excitable cells, including neurons, striated muscle cells, epithelial cells, and leukocytes. They mediate fast excitatory neurotransmission in the central and peripheral nervous systems and are thought to be involved in neuropathic pain, inflammation, and cell damage following ischemia-reperfusion injuries. P2X receptors are thus a target for the development of new therapeutics to treat chronic pain and inflammation. In this study, we characterized the inhibition caused by pyridoxal-5'-phosphate, a natural metabolite of vitamin B6 (MC-1), of P2X₂, P2X₄, P2X₇, and P2X₂/₃ receptors stably expressed in HEK293 cells using the patch-clamp technique in the whole-cell configuration. We also tested a new approach using VC6.1, a modified cameleon calcium-sensitive fluorescent protein, to characterize the inhibition of P2X₂ and P2X₂/₃. MC-1 blocked these two P2X receptors, with an IC₅₀ of 7 and 13 μmol/L, respectively. P2X₂ exhibited the highest affinity for VC6.1, and the chimeric receptor P2X₂/₃, the lowest. The patch-clamp and imaging approaches gave similar results and indicated that VC6.1 may be useful for high throughput drug screening. Pyridoxal-5'-phosphate is an efficient P2X blocker and can be classified as a P2X antagonist.",2014,Canadian journal of physiology and pharmacology,10.1139/cjpp-2013-0404,24593783,https://pubmed.ncbi.nlm.nih.gov/24593783/,24593783,,,false
pubmed:24532985:pubmed_K2_2026-07-10_cd801112,pubmed,K2,pubmed_K2_2026-07-10_cd801112,"Homocysteine Level and Mechanisms of Injury in Parkinson's Disease as Related to MTHFR, MTR, and MTHFD1 Genes Polymorphisms and L-Dopa Treatment.","An elevated concentration of total homocysteine (tHcy) in plasma and cerebrospinal fluid is considered to be a risk factor for Alzheimer's disease (AD) and Parkinson's disease (PD). Homocysteine (Hcy) levels are influenced by folate concentrations and numerous genetic factors through the folate cycle, however, their role in the pathogenesis of PD remains controversial. Hcy exerts a neurotoxic action and may participate in the mechanisms of neurodegeneration, such as excitotoxicity, oxidative stress, calcium accumulation, and apoptosis. Elevated Hcy levels can lead to prooxidative activity, most probably through direct interaction with N-methyl-D-aspartate (NMDA) receptors and sensitization of dopaminergic neurons to age-related dysfunction and death. Several studies have shown that higher concentration of Hcy in PD is related to long-term administration of levodopa (L-dopa). An elevation of plasma tHcy levels can also reflect deficiencies of cofactors in remethylation of Hcy to methionine (Met) (folates and vitamin B12) and in its transsulfuration to cysteine (Cys) (vitamin B6). It is believed that the increase in the concentration of Hcy in PD can affect genetic polymorphisms of the folate metabolic pathway genes, such as MTHFR (C677T, A1298C and G1793A), MTR (A2756G), and MTHFD1 (G1958A), whose frequencies tend to increase in PD patients, as well as the reduced concentration of B vitamins. In PD, increased levels of Hcy may lead to dementia, depression and progression of the disease.",2013,Current genomics,10.2174/1389202914666131210210559,24532985,https://pubmed.ncbi.nlm.nih.gov/24532985/,24532985,,,false
pubmed:24365548:pubmed_K2_2026-07-10_cd801112,pubmed,K2,pubmed_K2_2026-07-10_cd801112,Sensory polyneuropathy in human immunodeficiency virus-infected patients receiving tuberculosis treatment.,"SETTING: Human immunodeficiency virus (HIV) infection and treatments for HIV infection and tuberculosis (TB) are associated with the risk of developing sensory polyneuropathy (SPN). Vitamin B6 and genetically determined slow isoniazid (INH) acetylation are believed to play key roles in the development of SPN in a TB treatment setting.
OBJECTIVE: To investigate slow acetylation and risk factors for SPN in HIV-infected patients receiving TB treatment, and establish vitamin B6 status and its association with SPN.
METHODS: HIV-infected in-patients were prospectively assessed after initiating TB treatment and vitamin B6 supplementation, and monthly during hospitalisation. SPN was defined as ≥1 symptom plus ≥1 sign. NAT2 genotyping predicted acetylation status, and plasma high performance liquid chromatography estimated vitamin B6 status. A survival analysis estimated hazard ratios (HRs) for SPN during TB treatment.
RESULTS: Of 116 participants, 56% had SPN at study entry. Participants developed SPN at a rate of 26/100 person-months (95%CI 18-35) during TB treatment, which was independently associated with slow acetylation (HR 2.5; 95%CI 1.1-5.9), as well as black race, previous TB and extra-pulmonary/disseminated TB. Vitamin B6 status was normal, irrespective of SPN.
CONCLUSIONS: Risk factors for SPN suggest a multi-factorial pathogenesis related to INH and other potential nervous system insults. SPN developed despite normal vitamin B6 status, suggesting other mechanisms of injury.",2014,The international journal of tuberculosis and lung disease : the official journal of the International Union against Tuberculosis and Lung Disease,10.5588/ijtld.13.0375,24365548,https://pubmed.ncbi.nlm.nih.gov/24365548/,24365548,,,false
pubmed:24355920:pubmed_K2_2026-07-10_cd801112,pubmed,K2,pubmed_K2_2026-07-10_cd801112,Treatment of oxaliplatin-induced peripheral neuropathy by intravenous mangafodipir.,"BACKGROUND: The majority of patients receiving the platinum-based chemotherapy drug oxaliplatin develop peripheral neurotoxicity. Because this neurotoxicity involves ROS production, we investigated the efficacy of mangafodipir, a molecule that has antioxidant properties and is approved for use as an MRI contrast enhancer.
METHODS: The effects of mangafodipir were examined in mice following treatment with oxaliplatin. Neurotoxicity, axon myelination, and advanced oxidized protein products (AOPPs) were monitored. In addition, we enrolled 23 cancer patients with grade ≥ 2 oxaliplatin-induced neuropathy in a phase II study, with 22 patients receiving i.v. mangafodipir following oxaliplatin. Neuropathic effects were monitored for up to 8 cycles of oxaliplatin and mangafodipir.
RESULTS: Mangafodipir prevented motor and sensory dysfunction and demyelinating lesion formation. In mice, serum AOPPs decreased after 4 weeks of mangafodipir treatment. In 77% of patients treated with oxaliplatin and mangafodipir, neuropathy improved or stabilized after 4 cycles. After 8 cycles, neurotoxicity was downgraded to grade ≥ 2 in 6 of 7 patients. Prior to enrollment, patients received an average of 880 ± 239 mg/m2 oxaliplatin. Patients treated with mangafodipir tolerated an additional dose of 458 ± 207 mg/m2 oxaliplatin despite preexisting neuropathy. Mangafodipir responders managed a cumulative dose of 1,426 ± 204 mg/m2 oxaliplatin. Serum AOPPs were lower in responders compared with those in nonresponders.
CONCLUSION: Our study suggests that mangafodipir can prevent and/or relieve oxaliplatin-induced neuropathy in cancer patients. Trial registration. Clinicaltrials.gov NCT00727922. Funding. Université Paris Descartes, Ministère de la Recherche et de l'Enseignement Supérieur, and Assistance Publique-Hôpitaux de Paris.",2014,The Journal of clinical investigation,10.1172/JCI68730,24355920,https://pubmed.ncbi.nlm.nih.gov/24355920/,24355920,,,false
pubmed:24355918:pubmed_K2_2026-07-10_cd801112,pubmed,K2,pubmed_K2_2026-07-10_cd801112,The search for treatments to reduce chemotherapy-induced peripheral neuropathy.,"Oxaliplatin, a commonly used chemotherapeutic agent, is associated with both acute and chronic neurotoxicity. Chronic sensory neuropathy can be dose limiting and may have detrimental effects on patients' quality of life. Preclinical studies provide an understanding of the pathophysiology of chemotherapy-induced peripheral neuropathy (CIPN) and may be important for developing effective preventative interventions. In this issue of the JCI, Coriat and colleagues used an animal model and a human pilot trial to evaluate the use of mangafodipir to reduce CIPN. Although many pilot clinical studies have reported promising data, larger clinical trials have repeatedly been unable to confirm these preliminary results. Thus, no agents are currently clinically recommended for the prevention of CIPN.",2014,The Journal of clinical investigation,10.1172/JCI73908,24355918,https://pubmed.ncbi.nlm.nih.gov/24355918/,24355918,,,false
pubmed:24038589:pubmed_K2_2026-07-10_cd801112,pubmed,K2,pubmed_K2_2026-07-10_cd801112,Systematic administration of B vitamins attenuates neuropathic hyperalgesia and reduces spinal neuron injury following temporary spinal cord ischaemia in rats.,"BACKGROUND: B vitamins have been demonstrated to be effective in treating chronic pain due to peripheral nerve injury. We investigated whether B vitamins could alleviate neuropathic pain and reduce neuron injury following temporary ischaemia in a rat model of spinal cord ischaemia-reperfusion injury (SCII).
METHODS: SCII was produced by transiently blocking the unilateral lumbar arteries in adult male Sprague-Dawley rats. Behavioural and neurochemical signs of neuropathic pain and spinal neuron injury were analysed with and without B vitamin treatment.
RESULTS: SCII caused behavioural thermal hyperalgesia and mechanical allodynia and neurochemical alterations, including increased expression of the vanilloid receptor 1 (VR1) and induction of c-Fos, as well as activation of the astrocytes and microglial cells in the spinal cord. Repetitive systemic administration of vitamin B complex (B1/B6/B12 at 33/33/0.5 mg/kg, i.p., daily, for 7-14 consecutive days) significantly reduced thermal hyperalgesia and the increased expression of VR1 and c-Fos, as well as activation of the astrocytes and microglial cells. SCII caused a dramatic decrease of the expression of the rate-limiting enzyme glutamic acid decarboxylase-65 (GAD65), which synthesizes γ-aminobutyric acid (GABA) in the axonal terminals, and β-III-tubulin, and also caused loss of Nissl bodies in the spinal cord. These alterations were largely prevented and rescued by the B vitamin treatment.
CONCLUSIONS: These findings support the idea that the B vitamins are capable of neuroprotection and antinociception during spinal cord injury due to temporary ischaemia. Rescuing the loss of inhibitory GABAergic tone may reduce spinal central sensitization and contribute to B vitamin-induced analgesia.",2014,"European journal of pain (London, England)",10.1002/j.1532-2149.2013.00390.x,24038589,https://pubmed.ncbi.nlm.nih.gov/24038589/,24038589,,,false
pubmed:23829926:pubmed_K2_2026-07-10_cd801112,pubmed,K2,pubmed_K2_2026-07-10_cd801112,Nutritional disorders in tropical neurology.,"About three-fourths of the total world population live in the tropics but consume only 6% of worldwide food production and contribute 15% of the world's net revenue explaining the short life expectancy, high infantile mortality, and poor daily caloric intake; moreover, lack of clean drinking water and deficient sanitation promote water-borne infections, diarrhea, and risk of malabsorption that contribute to the prevalence of malnutrition in the tropics. One-third of the world's population consumes insufficient iodine increasing the risk for mental retardation and deafness due to maternal hypothyroidism. The main nutritional syndromes comprise protein-energy malnutrition (marasmus and kwashiorkor); nutritional neuropathies, myelopathies and neuromyelopathies, as well as specific deficiencies of vitamins and micronutrients including iodine, iron, zinc, and selenium.",2013,Handbook of clinical neurology,10.1016/B978-0-444-53490-3.00030-3,23829926,https://pubmed.ncbi.nlm.nih.gov/23829926/,23829926,,,false
pubmed:23747871:pubmed_K2_2026-07-10_cd801112,pubmed,K2,pubmed_K2_2026-07-10_cd801112,Serine racemase: a key player in neuron activity and in neuropathologies.,"Serine racemase is the pyridoxal 5'-phosphate-dependent enzyme that catalyzes L-serine racemisation to D-serine, and L- and D-serine beta-elimination in mammalian brain. D-serine is the essential co-agonist of the N-methyl-D-aspartate receptor, that mediates neurotransmission, synaptic plasticity, cell migration and long term potentiation. High and low D-serine levels have been associated with distinct neuropathologies, aging-related deficits and psychiatric disorders due to either hyper- or hypo-activation of the receptor. Serine racemase dual activity is regulated by ATP, divalent cations, cysteine nitrosylation, post-translational modifications, and interactions with proteins that bind either at the N- or C-terminus. A detailed elucidation of the molecular basis of catalysis, regulation and conformational plasticity, as well as enzyme and D-serine localization and neurons and astrocytes cross-talk, opens the way to the development of enzyme inhibitors and effectors for tailored therapeutic treatments.",2013,Frontiers in bioscience (Landmark edition),10.2741/4167,23747871,https://pubmed.ncbi.nlm.nih.gov/23747871/,23747871,,,false
pubmed:23647723:pubmed_K2_2026-07-10_cd801112,pubmed,K2,pubmed_K2_2026-07-10_cd801112,Nutraceuticals and chemotherapy induced peripheral neuropathy (CIPN): a systematic review.,"Chemotherapy induced peripheral neuropathy [CIPN] is a common significant and debilitating side effect resulting from the administration of neurotoxic chemotherapeutic agents. These pharmaco-chemotherapeutics can include taxanes, vinca alkaloids and others. Moderate to severe CIPN significantly decreases the quality of life and physical abilities of cancer patients and current pharmacotherapy for CIPN e.g. Amifostine and antidepressants have had limited efficacy and may themselves induce adverse side effects. To determine the potential use of nutraceuticals i.e. vitamin E, acetyl-L-carnitine, glutamine, glutathione, vitamin B6, omega-3 fatty acids, magnesium, calcium, alpha lipoic acid and n-acetyl cysteine as adjuvants in cancer treatments a systematic literature review was conducted. Revised clinical studies comprised of randomized clinical trials that investigated the anti-CIPN effect of nutraceuticals as the adjuvant intervention in patients administered chemotherapy. Twenty-four studies were assessed on methodological quality and limitations identified. Studies were mixed in their recommendations for nutraceuticals. Currently no agent has shown solid beneficial evidence to be recommended for the treatment or prophylaxis of CIPN. The standard of care for CIPN includes dose reduction and/or discontinuation of chemotherapy treatment. The management of CIPN remains an important challenge and future studies are warranted before recommendations for the use of supplements can be made.",2013,"Clinical nutrition (Edinburgh, Scotland)",10.1016/j.clnu.2013.04.007,23647723,https://pubmed.ncbi.nlm.nih.gov/23647723/,23647723,,,false
pubmed:23248429:pubmed_K2_2026-07-10_cd801112,pubmed,K2,pubmed_K2_2026-07-10_cd801112,Successful treatment of vincristine induced ptosis and polyneuropathy with pyridoxine and pyridostigmine in a child with acute lymphoblastic leukemia.,"Vincristine is used in the treatment of solid tumors, lymphoma and leukemia in children. The dose-limiting toxicity is its neurotoxicity. We describe a 2-year-old girl with acute lymphoblastic leukemia who developed vincristine-induced polyneuropathy with bilateral ptosis and recovered on treatment with pyridoxine and pyridostigmine.",2012,Indian journal of medical and paediatric oncology : official journal of Indian Society of Medical & Paediatric Oncology,10.4103/0971-5851.103152,23248429,https://pubmed.ncbi.nlm.nih.gov/23248429/,23248429,,,false
pubmed:23218892:pubmed_K2_2026-07-10_cd801112,pubmed,K2,pubmed_K2_2026-07-10_cd801112,Metanx in type 2 diabetes with peripheral neuropathy: a randomized trial.,"PURPOSE: To determine whether a combination of L-methylfolate, methylcobalamin, and pyridoxal-5'-phosphate (LMF-MC-PLP [Metanx; Pamlab LLC, Covington, La]) improves sensory neuropathy.
RESEARCH DESIGN AND METHODS: This multicenter, randomized, double-blind, placebo-controlled trial involved 214 patients with type 2 diabetes and neuropathy (baseline vibration perception threshold [VPT]: 25-45 volts), who were randomly assigned to 24 weeks of treatment with either L-methylfolate calcium 3 mg, methylcobalamin 2 mg, and pyridoxal-5'-phosphate 35 mg or placebo. The primary end point was effect on VPT. Secondary end points included Neuropathy Total Symptom Score (NTSS-6) and Short Form 36 (SF-36), as well as plasma levels of folate, vitamins B(6) and B(12), methylmalonic acid (MMA), and homocysteine.
RESULTS: There was no significant effect on VPT. However, patients receiving LMF-MC-PLP consistently reported symptomatic relief, with clinically significant improvement in NTSS-6 scores at week 16 (P=.013 vs placebo) and week 24 (P=.033). Improvement in NTSS scores was related to baseline MMA and inversely related to baseline PLP and metformin use. Quality-of-life measures also improved. Homocysteine decreased by 2.7±3.0 μmol/L with LMF-MC-PLP versus an increase of 0.5±2.4 μmol/L with placebo (P=.0001). Adverse events were infrequent, with no single event occurring in ≥2% of subjects.
CONCLUSIONS: LMF-MC-PLP appears to be a safe and effective therapy for alleviation of peripheral neuropathy symptoms, at least in the short term. Additional long-term studies should be conducted, as the trial duration may have been too short to show an effect on VPT. In addition, further research on the effects in patients with cobalamin deficiency would be useful.",2013,The American journal of medicine,10.1016/j.amjmed.2012.06.022,23218892,https://pubmed.ncbi.nlm.nih.gov/23218892/,23218892,,,false
pubmed:23151221:pubmed_K2_2026-07-10_cd801112,pubmed,K2,pubmed_K2_2026-07-10_cd801112,Multivitamin supplementation in HIV infected adults initiating antiretroviral therapy in Uganda: the protocol for a randomized double blinded placebo controlled efficacy trial.,"BACKGROUND: Use of multivitamin supplements during the pre-HAART era has been found to reduce viral load, enhance immune response, and generally improve clinical outcomes among HIV-infected adults. However, immune reconstitution is incomplete and significant mortality and opportunistic infections occur in spite of HAART. There is insufficient research information on whether multivitamin supplementation may be beneficial as adjunct therapy for HIV-infected individuals taking HAART. We propose to evaluate the efficacy of a single recommended daily allowance (RDA) of micronutrients (including vitamins B-complex, C, and E) in slowing disease progression among HIV-infected adults receiving HAART in Uganda.
METHODS/DESIGN: We are using a randomized, double-blind, placebo-controlled trial study design. Eligible patients are HIV-positive adults aged at least 18 years, and are randomized to receive either a placebo; or multivitamins that include a single RDA of the following vitamins: 1.4 mg B1, 1.4 mg B2, 1.9 mg B6, 2.6 mcg B12, 18 mg niacin, 70 mg C, 10 mg E, and 0.4 mg folic acid. Participants are followed for up to 18 months with evaluations at baseline, 6, 12 and 18 months. The study is primarily powered to examine the effects on immune reconstitution, weight gain, and quality of life. In addition, we will examine the effects on other secondary outcomes including the risks of development of new or recurrent disease progression event, including all-cause mortality; ARV regimen change from first- to second-line therapy; and other adverse events as indicated by incident peripheral neuropathy, severe anemia, or diarrhea.
DISCUSSIONS: The conduct of this trial provides an opportunity to evaluate the potential benefits of this affordable adjunct therapy (multivitamin supplementation) among HIV-infected adults receiving HAART in a developing country setting.
TRIAL REGISTRATION: Clinical Trial Registration-URL: http://www.clinicaltrials.gov. Unique identifier: NCT01228578.",2012,BMC infectious diseases,10.1186/1471-2334-12-304,23151221,https://pubmed.ncbi.nlm.nih.gov/23151221/,23151221,,,false
pubmed:23065838:pubmed_K2_2026-07-10_cd801112,pubmed,K2,pubmed_K2_2026-07-10_cd801112,Vitamin B-6 vitamer levels in plasma and related symptoms in hemodialysis subjects taking low- and high-dose renal multivitamin supplements.,"INTRODUCTION: The purpose of this study was to evaluate the B-6 vitamers in plasma and related symptoms in hemodialysis subjects taking high- or low-dose vitamins.
METHODS: A total of 24 hemodialysis (HD) subjects were divided into two groups. Twelve subjects received a high-dose vitamin supplement [50 mg pyridoxine hydrochloride (PN-HCl) /tablet] and 12 received a low-dose vitamin supplements containing (10 mg PN-HCl/tablet) for 6+ months. Plasma B-6 vitamers were analyzed using HPLC. Other data were obtained from subjects' medical records. Subjects were assessed for vitamin B-6 related symptoms. Cluster analysis was used to form symptom groups. Student t-tests and analysis of variance were used to determine differences (p < 0.05) in group means.
RESULTS: The mean ± SD plasma B-6 vitamer and 4-pyridoxic acid concentrations (nmol/L) were as follows in the 10-mg and 50-mg PN-HCl groups, respectively: pyridoxal- 5'-phosphate (PLP) 10 ± 3 and 16 ± 8 (p = 0.04); pyridoxal (PL) 50 ± 96 and 68 ± 06; pyridoxine (PN) 26 ± 50 and 191 ± 107; and 4-pyridoxic acid (4-PA) 43 ± 64 and 99 ± 361. The cluster group with a significantly higher (p = 0.04) plasma 4-PA concentration of 167 ± 697 nmol/L reported more tingling hands, tachycardia, and diarrhea.
CONCLUSION: Plasma PLP levels and symptoms related to B-6 in HD subjects are impacted by dose of PN-HCl.",2012,International journal for vitamin and nutrition research. Internationale Zeitschrift fur Vitamin- und Ernahrungsforschung. Journal international de vitaminologie et de nutrition,10.1024/0300-9831/a000102,23065838,https://pubmed.ncbi.nlm.nih.gov/23065838/,23065838,,,false
pubmed:22751692:pubmed_K2_2026-07-10_cd801112,pubmed,K2,pubmed_K2_2026-07-10_cd801112,Metanx alleviates multiple manifestations of peripheral neuropathy and increases intraepidermal nerve fiber density in Zucker diabetic fatty rats.,"Metanx is a product containing L-methylfolate, pyridoxal 5'-phosphate, and methylcobalamin for management of endothelial dysfunction. Metanx ingredients counteract endothelial nitric oxide synthase uncoupling and oxidative stress in vascular endothelium and peripheral nerve. This study evaluates Metanx on diabetic peripheral neuropathy in ZDF rats, a model of type 2 diabetes. Metanx was administered to 15-week-old ZDF and ZDF lean rats at either 4.87 mg ⋅ kg(-1) ⋅ day(-1) (a body weight-based equivalent of human dose) or 24.35 mg ⋅ kg(-1) ⋅ day(-1) by oral gavage two times a day for 4 weeks. Both doses alleviated hind limb digital sensory, but not sciatic motor, nerve conduction slowing and thermal and mechanical hypoalgesia in the absence of any reduction of hyperglycemia. Low-dose Metanx increased intraepidermal nerve fiber density but did not prevent morphometric changes in distal tibial nerve myelinated fibers. Metanx treatment counteracted endothelial nitric oxide synthase uncoupling, inducible nitric oxide synthase upregulation, and methylglyoxal-derived advanced glycation end product, nitrotyrosine, and nitrite/nitrate accumulation in the peripheral nerve. In conclusion, Metanx, at a body weight-based equivalent of human dose, increased intraepidermal nerve fiber density and improved multiple parameters of peripheral nerve function in ZDF rats. Clinical studies are needed to determine if Metanx finds use in management of diabetic peripheral neuropathy.",2012,Diabetes,10.2337/db11-1524,22751692,https://pubmed.ncbi.nlm.nih.gov/22751692/,22751692,,,false
