record_id,source,target_id,search_run_id,title,abstract_or_summary,year,journal_or_source,doi,pmid,url,raw_record_id,dedup_key,duplicate_of,is_duplicate
pubmed:35109718:pubmed_K2_2026-07-10_cd801112,pubmed,K2,pubmed_K2_2026-07-10_cd801112,D-Cycloserine-Induced Seizure Activity in the Emergency Department: A Case Report.,"D-cycloserine (DCS) is an anti-tuberculosis medication that has been utilized for years for drug-resistant tuberculosis. DCS works via a centrally acting mechanism which can cause neurotoxic adverse effects which has limited its use. This centrally acting mechanism also allows for DCS to be utilized for various neuropsychiatric purposes. Our patient was on high-dose DCS for autism spectrum disorder and presented to the emergency department (ED) with a seizure. The seizure episode was managed with both anti-epileptics and pyridoxine. With increasing novel use of this older medication, it is imperative for ED clinicians to be aware of the different management strategies that may be required when a patient presents with a neurotoxic effect, specifically seizures, secondary to DCS.",2023,Journal of pharmacy practice,10.1177/08971900221074955,35109718,https://pubmed.ncbi.nlm.nih.gov/35109718/,35109718,,,false
pubmed:35103387:pubmed_K2_2026-07-10_cd801112,pubmed,K2,pubmed_K2_2026-07-10_cd801112,B vitamin intakes modify the association between particulate air pollutants and incidence of all-cause dementia: Findings from the Women's Health Initiative Memory Study.,"INTRODUCTION: Particulate air pollutants may induce neurotoxicity by increasing homocysteine levels, which can be lowered by high B vitamin intakes. Therefore, we examined whether intakes of three B vitamins (folate, B12 , and B6 ) modified the association between PM2.5 exposure and incidence of all-cause dementia.
METHODS: This study included 7183 women aged 65 to 80 years at baseline. B vitamin intakes from diet and supplements were estimated by food frequency questionnaires at baseline. The 3-year average PM2.5 exposure was estimated using a spatiotemporal model.
RESULTS: During a mean follow-up of 9 years, 342 participants developed all-cause dementia. We found that residing in locations with PM2.5 exposure above the regulatory standard (12 μg/m3 ) was associated with a higher risk of dementia only among participants with lower intakes of these B vitamins.
DISCUSSION: This is the first study suggesting that the putative neurotoxicity of PM2.5 exposure may be attenuated by high B vitamin intakes.",2022,Alzheimer's & dementia : the journal of the Alzheimer's Association,10.1002/alz.12515,35103387,https://pubmed.ncbi.nlm.nih.gov/35103387/,35103387,,,false
pubmed:36875946:pubmed_K2_2026-07-10_cd801112,pubmed,K2,pubmed_K2_2026-07-10_cd801112,Pyridoxine in isoniazid-induced psychosis.,"Isoniazid is a first-line drug for the management of tuberculosis. Recent changes in paediatric tuberculosis guidelines have insisted on a higher daily dose of isoniazid. Given the burden of paediatric tuberculosis in developing countries, it is pertinent that paediatricians are well versed with all possible adverse effects associated with isoniazid therapy and not just common ones like hepatotoxicity or peripheral neuropathy. Psychosis is one such rare adverse effect which has a reported incidence of 1%-2%. Here, we report a case of isoniazid-induced psychosis in a 4-year-old girl. The purpose of this report is to sensitise the paediatric healthcare community regarding this rare clinical entity along with highlighting the putative role of pyridoxine supplementation in the management of isoniazid-induced psychosis.",2022,Sudanese journal of paediatrics,10.24911/SJP.106-1584524803,36875946,https://pubmed.ncbi.nlm.nih.gov/36875946/,36875946,,,false
pubmed:34931740:pubmed_K2_2026-07-10_cd801112,pubmed,K2,pubmed_K2_2026-07-10_cd801112,Vitamin B6 levels do not correlate with severity of neuropathy in chronic idiopathic axonal polyneuropathy.,"Pyridoxine (vitamin B6) toxicity is known to cause a length-dependent, sensory predominant axonal polyneuropathy. There is debate regarding the threshold at which intake levels can cause neurological symptoms through pyridoxine toxicity. We asked if elevated plasma vitamin B6 levels were related to outcome measures in a well-characterized cohort of patients with chronic idiopathic axonal polyneuropathy (CIAP). We included 261 patients enrolled in the Peripheral Neuropathy Research Registry who had a complete dataset including a plasma vitamin B6 value. Patients with vitamin B6 deficiency (0-4.9 μg/L) were excluded. We performed a chi-square test for independence and analyzed the logistic relation of elevated plasma B6 level to nerve conduction studies (NCS), neurological examination findings, and patient-reported symptoms controlling for age and time elapsed since neuropathy symptom onset. Plasma B6 level was not related to neuropathy severity. There was no logistic relation of elevated plasma B6 level to NCS results, examination features including toe strength, vibration sense, and deep tendon reflexes, or patient-reported numbness or pain intensity. This study suggests that moderately elevated plasma B6 levels, even in the 100 to 200 μg/L range, are not associated with significantly worse neuropathy signs or symptoms. Although standard supplementation of B6 does not appear to have a major negative affect on CIAP, this study does not directly answer whether stopping supplementation will have a beneficial effect. Very few patients in the study had vitamin B6 levels >300 μg/L, suggesting that screening for vitamin B6 toxicity may be left to the discretion of the physician.",2022,Journal of the peripheral nervous system : JPNS,10.1111/jns.12480,34931740,https://pubmed.ncbi.nlm.nih.gov/34931740/,34931740,,,false
pubmed:34758207:pubmed_K2_2026-07-10_cd801112,pubmed,K2,pubmed_K2_2026-07-10_cd801112,Polyneuropathy monitoring in Parkinson's disease patients treated with levodopa/carbidopa intestinal gel.,"OBJECTIVES: Levodopa-carbidopa-intestinal-gel (LCIG) infusion is an effective treatment for advanced PD with motor fluctuations. Polyneuropathy occurs as a complication in 10-15% of patients. We wanted to assess the frequency of polyneuropathy in Finnish advanced Parkinson's disease (PD) patients with continuous LCIG infusion, and the value of different clinical monitoring parameters during follow-up.
MATERIALS AND METHODS: Patient records of PD patients started on LCIG infusion at Helsinki University Hospital who received nerve conduction studies at baseline and 6 months after treatment initiation were reviewed for epidemiological information, mini mental state examination, baseline and 6 months' UPRDS-III, weight, body mass index, levodopa dose (LD), plasma homocysteine levels, folate, vitamin B6 and B12.
RESULTS: Out of 19 patients (n = 6 on B-vitamin substitution), two (10.5%) developed new-onset polyneuropathy after initiation of LCIG therapy (n = 0 with vitamin substitution). Neuropathy was associated with significant weight loss (BMI reduction > 1.5), but not with other monitoring parameters. Homocysteine rose significantly in patients not substituted with B-vitamin complex, but not in patients with B-vitamin substitution. Homocysteine changes correlated with LD changes in the absence of vitamin B substitution. After oral B-vitamin substitution, both patients' polyneuropathy remained electrophysiologically and clinically stable.
CONCLUSIONS: Rates of polyneuropathy in Finnish PD patients with LCIG treatment are comparable to previous studies. Patients' weight should be included in regular follow up monitoring and can be used for patient self-monitoring. Vitamin B substitution appears to reduce coupling between levodopa dose and homocysteine and may be useful to prevent polyneuropathy related to LCIG.",2021,Brain and behavior,10.1002/brb3.2408,34758207,https://pubmed.ncbi.nlm.nih.gov/34758207/,34758207,,,false
pubmed:34677616:pubmed_K2_2026-07-10_cd801112,pubmed,K2,pubmed_K2_2026-07-10_cd801112,Blood Neurofilament Light Chain as a Potential Biomarker for Central and Peripheral Nervous Toxicity in Rats.,"Neurotoxicity is a principal concern in nonclinical drug development. However, standardized and universally accepted fluid biomarkers for evaluating neurotoxicity are lacking. Increasing clinical evidence supports the potential use of neurofilament light (NfL) chain as a biomarker of several neurodegenerative diseases; therefore, we investigated changes in the cerebrospinal fluid (CSF) and serum levels of NfL in Sprague Dawley rats treated with central nervous system (CNS) toxicants (trimethyltin [TMT, 10 mg/kg po, single dose], kainic acid [KA, 12 mg/kg sc, single dose], MK-801 [1 mg/kg sc, single dose]), and a peripheral nervous system (PNS) toxicant (pyridoxine, 1200 mg/kg/day for 3 days). Animals were euthanized 1 (day 2), 3 (day 4), or 7 days after administration (day 8). Increased serum NfL was observed in TMT- and KA-treated animals, which indicated neuronal cell death in the brain on days 2, 4, and/or 8. MK-801-treated animals exhibited no changes in the serum and CSF levels of NfL and no histopathological changes in the brain at any time point. Pyridoxine-induced chromatolysis of the dorsal root ganglion on day 2 and degeneration of peripheral nerve fiber on day 4; additionally, serum NfL was increased. A strong correlation was observed between the serum and CSF levels of NfL and brain lesions caused by TMT and KA, indicating that NfL could be a useful biomarker for detecting CNS toxicity. Additionally, PNS changes were correlated with serum NfL levels. Therefore, serum NfL could serve as a useful peripheral biomarker for detecting both CNS and PNS toxicity in rats.",2021,Toxicological sciences : an official journal of the Society of Toxicology,10.1093/toxsci/kfab122,34677616,https://pubmed.ncbi.nlm.nih.gov/34677616/,34677616,,,false
pubmed:34498362:pubmed_K2_2026-07-10_cd801112,pubmed,K2,pubmed_K2_2026-07-10_cd801112,Non-drug pain relievers active on non-opioid pain mechanisms.,"This review is aimed to summarize the pain-relieving effect of non-drug substances, mostly prescribed as integrators in treatment of pain, including especially in chronic postoperative pain (CPSP) and in chronic back pain after acute episodes. Their use reflects the fact that the current treatments for these syndromes continue to pose problems of unsatisfactory responses in a significant portion of patients and/or of an excess of side effects like those noted in the present opioid crisis. As integrators are frequently introduced into the market without adequate clinical testing, this review is aimed to collect the present scientific evidence either preclinical or clinical for their effectiveness. In particular, we reviewed the data on the use of: B vitamins; vitamin C; vitamin D; alpha lipoic acid (ALA); N-acetylcysteine; acetyl L-carnitine; curcumin; boswellia serrata; magnesium; coenzyme Q10, and palmitoylethanolamide. The combination of preclinical findings and clinical observations strongly indicate that these compounds deserve more careful attention, some of them having interesting clinical potentials also in preventing chronic pain after an acute episode. In particular, examining their putative mechanisms of action it emerges that combinations of few of them may exert an extraordinary spectrum of activities on a large variety of pain-associated pathways and may be eventually used in combination with more traditional pain killers in order to extend the duration of the effect and to lower the doses. Convincing examples of effective combinations against pain are vitamin B complex plus gabapentin for CPSP, including neuropathic pain; vitamin B complex plus diclofenac against low back pain and also in association with gabapentin, and ALA for burning mouth syndrome. These as well as other examples need, however, careful controlled independent clinical studies confirming their role in therapy.",2022,Pain practice : the official journal of World Institute of Pain,10.1111/papr.13073,34498362,https://pubmed.ncbi.nlm.nih.gov/34498362/,34498362,,,false
pubmed:34495967:pubmed_K2_2026-07-10_cd801112,pubmed,K2,pubmed_K2_2026-07-10_cd801112,Is impaired energy production a novel insight into the pathogenesis of pyridoxine-dependent epilepsy due to biallelic variants in ALDH7A1?,"BACKGROUND: Pyridoxine-dependent epilepsy (PDE) is due to biallelic variants in ALDH7A1 (PDE-ALDH7A1). ALDH7A1 encodes α-aminoadipic semialdehyde dehydrogenase in lysine catabolism. We investigated the gamma aminobutyric acid (GABA) metabolism and energy production pathways in human PDE-ALDH7A1 and its knock-out aldh7a1 zebrafish model.
METHODS: We measured GABA pathway, and tricarboxylic acid cycle metabolites and electron transport chain activities in patients with PDE-ALDH7A1 and in knock-out aldh7a1 zebrafish.
RESULTS: We report results of three patients with PDE-ALDH7A1: low paired complex I+II and complex II+III and individual complex IV activities in muscle biopsy in patient 1 (likely more severe phenotype); significantly elevated CSF glutamate in the GABA pathway and elevated CSF citrate, succinate, isocitrate and α-ketoglutarate in the TCA cycle in patient 3 (likely more severe phenotype); and normal CSF GABA pathway and TCA cycle metabolites on long-term pyridoxine therapy in patient 2 (likely milder phenotype). All GABA pathway metabolites (γ-hydroxybutyrate, glutamine, glutamate, total GABA, succinic semialdehyde) and TCA cycle metabolites (citrate, malate, fumarate, isocitrate, lactate) were significantly low in the homozygous knock-out aldh7a1 zebrafish compared to the wildtype zebrafish. Homozygous knock-out aldh7a1 zebrafish had decreased electron transport chain enzyme activities compared to wildtype zebrafish.
DISCUSSION: We report impaired electron transport chain function, accumulation of glutamate in the central nervous system and TCA cycle dysfunction in human PDE-ALDH7A1 and abnormal GABA pathway, TCA cycle and electron transport chain in knock-out aldh7a1 zebrafish. Central nervous system glutamate toxicity and impaired energy production may play important roles in the disease neuropathogenesis and severity in human PDE-ALDH7A1.",2021,PloS one,10.1371/journal.pone.0257073,34495967,https://pubmed.ncbi.nlm.nih.gov/34495967/,34495967,,,false
pubmed:34477538:pubmed_K2_2026-07-10_cd801112,pubmed,K2,pubmed_K2_2026-07-10_cd801112,Neuroprotective Role of the B Vitamins in the Modulation of the Central Glutamatergic Neurotransmission.,"BACKGROUND: Regulation of glutamate release is crucial for maintaining normal brain function, but excess glutamate release is implicated in many neuropathological conditions. Therefore, the minimum glutamate release from presynaptic nerve terminals is an important neuroprotective mechanism.
OBJECTIVE: In this mini-review, we analyze the three B vitamins, namely vitamin B2 (riboflavin), vitamin B6 (pyridoxine), and vitamin B12 (cyanocobalamin), that affect the 4-aminopyridine (4- AP)-evoked glutamate release from presynaptic nerve terminal in rat and discuss their neuroprotective role.
METHODS: In this study, the measurements include glutamate release, DiSC3(5), and Fura-2.
RESULTS: The riboflavin, pyridoxine, and cyanocobalamin produced significant inhibitory effects on 4-aminopyridine-evoked glutamate release from rat cerebrocortical nerve terminals (synaptosomes) in a dose-dependent relationship. These presynaptic inhibitory actions of glutamate release are attributed to inhibition of physiologic Ca2+-dependent vesicular exocytosis but not Ca2+-independent nonvesicular release. These effects also did not affect membrane excitability, while diminished cytosolic (Ca2+)c through a reduction of direct Ca2+ influx via Cav2.2 (N-type) and Cav2.1 (P/Q-type) Ca2+ channels, rather than through indirect Ca2+induced Ca2+ release from ryanodine-sensitive intracellular stores. Furthermore, their effects were attenuated by GF109203X and Ro318220, two protein kinase C (PKC) inhibitors, suggesting suppression of PKC activity. Taken together, these results suggest that riboflavin, pyridoxine, and cyanocobalamin inhibit presynaptic vesicular glutamate release from rat cerebrocortical synaptosomes, through the depression Ca2+ influx via voltage- dependent Cav2.2 (N-type) and Cav2.1 (P/Q-type) Ca2+ channels, and PKC signaling cascade.
CONCLUSION: Therefore, these B vitamins may reduce the strength of glutamatergic synaptic transmission and is of considerable importance as potential targets for therapeutic agents in glutamate- induced excitation-related diseases.",2022,CNS & neurological disorders drug targets,10.2174/1871527320666210902165739,34477538,https://pubmed.ncbi.nlm.nih.gov/34477538/,34477538,,,false
pubmed:34309959:pubmed_K2_2026-07-10_cd801112,pubmed,K2,pubmed_K2_2026-07-10_cd801112,Effect of vitamin B6 on brain damage in valproic acid induced toxicity.,"Valproic acid (VPA) is an efficient antiepileptic drug widely used for the treatment of epilepsy and other seizures in both children and adults. It is also reported to have side and toxic effects on many organs and tissues. Vitamin B6 (Vit B6 ) is a well-described water-soluble vitamin, which has an antioxidant effect. In this study, we aimed to investigate the protective effect of Vit B6 on VPA-induced brain injury. Male Sprague-Dawley rats were divided into four groups. Group I, control animals; Group II, Vit B6 (50 mg/kg/day) given rats; Group III, VPA (500 mg/kg/day) given rats; Group IV, VPA and Vit B6 given rats at same dose and time. VPA and Vit B6 were administered intraperitoneally and orally, respectively, for 7 days. At the end of the experiments, the rats were sacrificed and brain tissues were taken. Protein carbonyl and sialic acid levels, xanthine oxidase, adenosine deaminase, acetylcholine esterase, lactate dehydrogenase, myeloperoxidase activities, total oxidant status, and reactive oxygen species levels were found to be increased, while glutathione and total antioxidant capacity levels, catalase, superoxide dismutase, glutathione-S-transferase, paraoxonase, and glutathione reductase activities were found to be decreased in the VPA group. Administration of Vit B6 reversed these defects in the VPA group. These findings indicate that Vit B6 has a protective effect on VPA-induced brain damage.",2021,Journal of biochemical and molecular toxicology,10.1002/jbt.22855,34309959,https://pubmed.ncbi.nlm.nih.gov/34309959/,34309959,,,false
pubmed:34138754:pubmed_K2_2026-07-10_cd801112,pubmed,K2,pubmed_K2_2026-07-10_cd801112,Untargeted metabolomics and infrared ion spectroscopy identify biomarkers for pyridoxine-dependent epilepsy.,"BackgroundPyridoxine-dependent epilepsy (PDE-ALDH7A1) is an inborn error of lysine catabolism that presents with refractory epilepsy in newborns. Biallelic ALDH7A1 variants lead to deficiency of α-aminoadipic semialdehyde dehydrogenase/antiquitin, resulting in accumulation of piperideine-6-carboxylate (P6C), and secondary deficiency of the important cofactor pyridoxal-5'-phosphate (PLP, active vitamin B6) through its complexation with P6C. Vitamin B6 supplementation resolves epilepsy in patients, but intellectual disability may still develop. Early diagnosis and treatment, preferably based on newborn screening, could optimize long-term clinical outcome. However, no suitable PDE-ALDH7A1 newborn screening biomarkers are currently available.MethodsWe combined the innovative analytical methods untargeted metabolomics and infrared ion spectroscopy to discover and identify biomarkers in plasma that would allow for PDE-ALDH7A1 diagnosis in newborn screening.ResultsWe identified 2S,6S-/2S,6R-oxopropylpiperidine-2-carboxylic acid (2-OPP) as a PDE-ALDH7A1 biomarker, and confirmed 6-oxopiperidine-2-carboxylic acid (6-oxoPIP) as a biomarker. The suitability of 2-OPP as a potential PDE-ALDH7A1 newborn screening biomarker in dried bloodspots was shown. Additionally, we found that 2-OPP accumulates in brain tissue of patients and Aldh7a1-knockout mice, and induced epilepsy-like behavior in a zebrafish model system.ConclusionThis study has opened the way to newborn screening for PDE-ALDH7A1. We speculate that 2-OPP may contribute to ongoing neurotoxicity, also in treated PDE-ALDH7A1 patients. As 2-OPP formation appears to increase upon ketosis, we emphasize the importance of avoiding catabolism in PDE-ALDH7A1 patients.FundingSociety for Inborn Errors of Metabolism for Netherlands and Belgium (ESN), United for Metabolic Diseases (UMD), Stofwisselkracht, Radboud University, Canadian Institutes of Health Research, Dutch Research Council (NWO), and the European Research Council (ERC).",2021,The Journal of clinical investigation,10.1172/JCI148272,34138754,https://pubmed.ncbi.nlm.nih.gov/34138754/,34138754,,,false
pubmed:34113965:pubmed_K2_2026-07-10_cd801112,pubmed,K2,pubmed_K2_2026-07-10_cd801112,Dietary Approaches to Improve Efficacy and Control Side Effects of Levodopa Therapy in Parkinson's Disease: A Systematic Review.,"Although levodopa remains the most effective drug for symptomatic management of Parkinson's Disease (PD), treatment during advanced disease stages may raise unpredictable motor fluctuations and other complications. Counteracting these complications with other pharmacological therapies may prompt a vicious circle of side effects, and here, nutritional therapy may have great potential. Knowledge about the role of diet in PD is emerging and multiple studies have investigated nutritional support specifically with respect to levodopa therapy. With this systematic review, we aim to give a comprehensive overview of dietary approaches to optimize levodopa treatment in PD. A systematic search was performed using the databases of PubMed and Scopus between January 1985 and September 2020. Nutritional interventions with the rationale to optimize levodopa therapy in human PD patients were eligible for this study and their quality was assessed with the Cochrane risk-of-bias tool. In total, we included 22 papers that addressed the effects of dietary proteins (n = 10), vitamins (n = 7), fiber (n = 2), soybeans (n = 1), caffeine (n = 1), and ketogenic diets (n = 1) on levodopa therapy. Interventions with protein redistribution diets (PRDs), dietary fiber, vitamin C, and caffeine improved levodopa absorption, thereby enhancing clinical response and reducing motor fluctuations. Furthermore, supplementation of vitamin B-12, vitamin B-6, and folic acid successfully reduced high homocysteine concentrations that emerged from levodopa metabolism and promoted many metabolic and clinical complications, such as neuropathology and osteoporosis. In conclusion, dietary interventions have the potential to optimize levodopa efficacy and control side effects. Nutrition that improves levodopa absorption, including PRDs, fiber, vitamin C, and caffeine, is specifically recommended when fluctuating clinical responses appear. Supplements of vitamin B-12, vitamin B-6, and folic acid are advised along with levodopa initiation to attenuate hyperhomocysteinemia, and importantly, their potential to treat consequent metabolic and clinical complications warrants future research.",2021,"Advances in nutrition (Bethesda, Md.)",10.1093/advances/nmab060,34113965,https://pubmed.ncbi.nlm.nih.gov/34113965/,34113965,,,false
pubmed:33958192:pubmed_K2_2026-07-10_cd801112,pubmed,K2,pubmed_K2_2026-07-10_cd801112,Isolated Pyridoxine Deficiency Presenting as Muscle Spasms in a Patient With Type 2 Diabetes: A Case Report and Literature Review.,"Pyridoxine is an important co-factor for many biochemical reactions in cellular metabolism related to the synthesis and catabolism of amino acids, fatty acids, neurotransmitters. Deficiency of pyridoxine results in impaired transcellular signaling between neurons and presents with muscular convulsions, hyperirritability, and peripheral neuropathy. Deficiency of pyridoxine is usually found in association with other vitamin B deficiencies such as folate (vitamin B9) and cobalamin (vitamin B12). Isolated pyridoxine deficiency is extremely rare. We present the case of a 59-year old female with type 2 diabetes who complained of painful muscle spasms. Her muscle spasms involved in both feet, which have spread proximally to her legs. She also experienced intermittent muscle spasms in her left arm, which is not alleviated by baclofen, cyclobenzaprine. Her plasma pyridoxal 5-phosphate confirmed pyridoxine deficiency. Vitamins B1, B3, B12, and folate were within normal limits. The patient received standard-dose intramuscular pyridoxine injections for three weeks followed by oral supplements for 3 months and her symptoms resolved. This case illustrates the rare instance of isolated pyridoxine deficiency in type 2 diabetes patient manifesting as myoclonic muscle spasms involving the legs and arms in the absence of objective polyneuropathy. Pyridoxine level should, therefore, be assessed in patients with type 2 diabetes, including newly diagnosed patients.",2021,The American journal of the medical sciences,10.1016/j.amjms.2020.10.027,33958192,https://pubmed.ncbi.nlm.nih.gov/33958192/,33958192,,,false
