record_id,source,target_id,search_run_id,title,abstract_or_summary,year,journal_or_source,doi,pmid,url,raw_record_id,dedup_key,duplicate_of,is_duplicate
pubmed:16079465:pubmed_K2_2026-07-10_cd801112,pubmed,K2,pubmed_K2_2026-07-10_cd801112,The high atherosclerotic risk among epileptics: the atheroprotective role of multivitamins.,"Neurologists have little concern about the high atherosclerotic risk among epileptics. Recent evidences mount that chronic epilepsy and prolonged use of antiepileptic drugs (AEDs) are associated with multiple risk factors that are critically implicated in pathobiology and dysfunction of the vessel wall through complex molecular mechanisms that promote atherogenesis. This review is concerned with three metabolic alterations, which are attributed as major risk factors for atherosclerosis among epileptics: altered metabolism of a) homocysteine (Hcy), b) lipids and lipoproteins, and c) uric acid. Most conventional AEDs reduce folic acid levels, thereby raising Hcy levels. Hyperhomosysteinemia is recently believed to induce endothelial dysfunction and promote atherosclerosis through complex oxidative and excitatory neurotoxic molecular mechanisms. However, Hcy itself is a convulsing substance with increased seizure recurrence and intractability to antiepileptic medications. AEDs can disturb lipid metabolism with resultant hypercholestrolemia and dyslipidemia, common recognized risks for atherosclerosis. Altered uric acid metabolism is common among epileptics. Uric acid has been implicated in endothelial cell damage and decreased endothelial nitric oxide bioavailability. In the presence of atherosclerotic milieu, uric acid interacts with other substrate toxicities and increased reactive oxygen species, accelerating atherosclerosis. The above information forms the rationale for future routine screening and correction of such metabolic alterations in epileptics. A convincing argument now develops that routine polyvitamin supplementation (folic acid, vitamin B12, vitamin B6, vitamin C, vitamin E, and beta-carotene) becomes increasingly important for women and men receiving AEDs at all ages. The atheroprotective effect of multivitamins is through their antioxidant and anti-inflammatory effects together with their lipid and Hcy lowering effects.",2005,Journal of pharmacological sciences,10.1254/jphs.crj05003x,16079465,https://pubmed.ncbi.nlm.nih.gov/16079465/,16079465,,,false
pubmed:16038024:pubmed_K2_2026-07-10_cd801112,pubmed,K2,pubmed_K2_2026-07-10_cd801112,Oral Xeloda plus bi-platinu two-way combined chemotherapy in treatment of advanced gastrointestinal malignancies.,"AIM: To compare the effect, adverse events, cost-effectiveness and dose intensity (DI) of oral Xeloda vs calcium folinate (CF)/5-FU combination chemotherapy in patients with advanced gastrointestinal malignancies, both combined with bi-platinu two-way chemotherapy.
METHODS: A total of 131 patients were enrolled and randomly selected to receive either oral Xeloda (X group) or CF/5-FU (control group). Oral Xeloda 1,000 mg/m2 was administered twice daily from d 1 to 14 in X group, while CF 200 mg/m2 was taken as a 2-h intravenous infusion followed by 5-FU 600 mg/m2 intravenously for 4-6 h on d 1-5 in control group. Cisplatin and oxaliplatin were administered in the same way to both the groups: cisplatin 60-80 mg/m2 by hyperthermic intraperitoneal administration, and oxaliplatin 130 mg/m2 intravenously for 2 h on d 1. All the drugs were recycled every 21 d, with at least two cycles. Pyridoxine 50 mg was given t.i.d. orally for prophylaxis of the hand-foot syndrome (HFS). Then the effect, adverse events, cost-effectiveness and DI of the two groups were evaluated.
RESULTS: Hundred and fourteen cases (87.0%) finished more than two chemotherapy cycles. The overall response rate of them was 52.5% (X group) and 42.4% (control group) respectively. Tumor progression time (TTP) was 7.35 mo vs 5.95 mo, and 1-year survival rate was 53.1% vs 44.5%. There was a remarkable statistical significance of TTP and 1-year survival between the two groups. The main Xeloda-related adverse events were myelosuppression, gastrointestinal toxicity, neurotoxicity and HFS, which were mild and well tolerable. Therefore, no patients withdrew from the study due to side effects before two chemotherapy cycles were finished. Both groups finished pre-arranged DI and the relative DI was nearly 1.0. The average cost for 1 patient in one cycle was RMB9 137.35 (X group) and RMB8 961.72 (control group), or USD1 100.89 in X group and USD1 079.73 in control group. To add 1% to the response rate costs RMB161.44 vs RMB210.37 respectively (USD19.45 vs USD25.35). One-month prolongation of TTP costs RMB1 243.18 vs RMB1 506.17 (USD149.78 vs USD181.47). Escalation of 1% of 1-year survival costs RMB172.74 vs RMB201.64 (USD20.75 vs USD24.29).
CONCLUSION: Oral Xeloda combined with bi-platinu two-way combination chemotherapy is efficient and tolerable for patients with advanced gastrointestinal malignancies; meanwhile the expenditure is similar to that of CF/5-FU combined with bi-platinu chemotherapy, and will be cheaper if we are concerned about the increase of the response rate, TTP or 1-year-survival rate pharmacoeconomically.",2005,World journal of gastroenterology,10.3748/wjg.v11.i28.4300,16038024,https://pubmed.ncbi.nlm.nih.gov/16038024/,16038024,,,false
pubmed:15940093:pubmed_K2_2026-07-10_cd801112,pubmed,K2,pubmed_K2_2026-07-10_cd801112,Tetramethylenedisulfotetramine: old agent and new terror.,"Tetramethylenedisulfotetramine has accounted for numerous intentional and unintentional poisonings in China. In May 2002, the first known case of human illness in the United States caused by tetramethylenedisulfotetramine, a banned neurotoxic rodenticide from China, occurred in New York City. The clinical presentation after tetramethylenedisulfotetramine exposure is dose dependent, and the most recognized complication is status epilepticus. Poisonings may be fatal within hours. No known antidote exists, and treatment is mainly supportive. Anecdotal reports, case reports, and 2 animal studies suggest possible success with certain pharmacologic interventions, including pyridoxine and chelation therapy. Pesticide and rodenticide poisonings, whether intentional or unintentional, pose a serious threat to populations, and the availability of a banned rodenticide such as tetramethylenedisulfotetramine, with its associated morbidity and lethality, is a serious public health concern. Given the recent case report that confirms the presence of tetramethylenedisulfotetramine in the United States, the toxicity of the compound, its unique physical properties, the absence of an antidote, and the history of its use as an agent of intentional mass poisoning, public health entities have undertaken educational efforts to inform the public, health care providers, and emergency personnel of this potentially lethal rodenticide.",2005,Annals of emergency medicine,10.1016/j.annemergmed.2004.09.009,15940093,https://pubmed.ncbi.nlm.nih.gov/15940093/,15940093,,,false
pubmed:15927533:pubmed_K2_2026-07-10_cd801112,pubmed,K2,pubmed_K2_2026-07-10_cd801112,Long-term neuroprotection achieved with latency-associated promoter-driven herpes simplex virus gene transfer to the peripheral nervous system.,"We examined the ability of the herpes simplex virus (HSV) latency-associated promoter (LAP2) to drive biologically relevant prolonged transgene expression in the peripheral nervous system. Rat dorsal root ganglia were transduced in vivo by subcutaneous inoculation of replication-incompetent HSV-based vectors containing nerve growth factor (NGF) or neurotrophin-3 (NT-3) under the control of LAP2 (vectors SLN and QLNT3, respectively) and vector SHN expressing NGF under the control of the human cytomegalovirus immediate early promoter. Twenty-four weeks later a pure sensory neuropathy was induced by overdose of pyridoxine (PDX), and the animals were assessed 6 months after inoculation. Inoculation of SLN, but not SHN, attenuated the nerve damage caused by PDX and protected foot sensory amplitude, H-wave amplitude, and behavioral measures of proprioceptive function. QLNT3 was more effective than SLN in preserving the largest myelinated fibers from degeneration. These results indicate that expression of NGF or NT-3 driven by LAP2 is sufficient to prevent the development of neuropathy 6 months after vector inoculation in rats.",2005,Molecular therapy : the journal of the American Society of Gene Therapy,10.1016/j.ymthe.2005.04.009,15927533,https://pubmed.ncbi.nlm.nih.gov/15927533/,15927533,,,false
pubmed:15740844:pubmed_K2_2026-07-10_cd801112,pubmed,K2,pubmed_K2_2026-07-10_cd801112,P2 receptor antagonist PPADS confers neuroprotection against glutamate/NMDA toxicity.,"The present study investigated the role of pyridoxal phosphate-6-azophenyl-2',4'-disulfonic acid tetrasodium salt (PPADS), a P2 receptor antagonist, in protecting mouse cerebellar granule neurons (CGNs) against glutamate/NMDA-induced neuronal death. Neurotoxicity caused by 50 microM glutamate or 200 microM NMDA was significantly reduced in CGNs treated with PPADS. Such neuroprotection was in a time- and dose-dependent manner. The possibility that PPADS may block glutamate/NMDA-mediated intracellular Ca2+ influx to CGNs was investigated using temperature-controlled platereader measurements of fluorescence intensity of CGNs loaded with Ca2+-sensitive fluorescent dye Fluo-4AM. Interestingly, the rapid increase of calcium influx following glutamate/NMDA treatment was not significantly affected by prior treatment with PPADS. In contrast, MK801, a specific NMDA receptor antagonist, completely blocked intracellular Ca2+ influx. Taken together, these data suggest that inhibition of the P2 receptor may directly modulate NMDA receptor-mediated neurotoxicity through a Ca2+-independent mechanism.",2005,Neuroscience letters,10.1016/j.neulet.2004.11.075,15740844,https://pubmed.ncbi.nlm.nih.gov/15740844/,15740844,,,false
pubmed:15733653:pubmed_K2_2026-07-10_cd801112,pubmed,K2,pubmed_K2_2026-07-10_cd801112,"Thiamine, pyridoxine, cyanocobalamin and their combination inhibit thermal, but not mechanical hyperalgesia in rats with primary sensory neuron injury.","Neuropathic pain after nerve injury is severe and intractable, and current drugs and nondrug therapies offer substantial pain relief to no more than half of affected patients. The present study investigated the analgesic roles of the B vitamins thiamine (B1), pyridoxine (B6) and cyanocobalamin (B12) in rats with neuropathic pain caused by spinal ganglia compression (CCD) or loose ligation of the sciatic nerve (CCI). Thermal hyperalgesia was determined by a significantly shortened latency of foot withdrawal to radiant heat, and mechanical hyperalgesia was determined by a significantly decreased threshold of foot withdrawal to von Frey filaments stimulation of the plantar surface of hindpaw. Results showed that (1) intraperitoneal injection of B1 (5, 10, 33 and 100 mg/kg), B6 (33 and 100 mg/kg) or B12 (0.5 and 2 mg/kg) significantly reduced thermal hyperalgesia; (2) the combination of B1, B6 and B12 synergistically inhibited thermal hyperalgesia; (3) repetitive administration of vitamin B complex (containing B1/B6/B12 33/33/0.5 mg/kg, for 1 and 2 wk) produced long-term inhibition of thermal hyperalgesia; and (4) B vitamins did not affect mechanical hyperalgesia or normal pain sensation, and exhibited similar effects on CCD and CCI induced-hyperalgesia. The present studies demonstrate effects of B vitamins on pain and hyperalgesia following primary sensory neurons injury, and suggest the possible clinical utility of B vitamins in the treatment of neuropathic painful conditions following injury, inflammation, degeneration or other disorders in the nervous systems in human beings.",2005,Pain,10.1016/j.pain.2004.12.027,15733653,https://pubmed.ncbi.nlm.nih.gov/15733653/,15733653,,,false
pubmed:15633627:pubmed_K2_2026-07-10_cd801112,pubmed,K2,pubmed_K2_2026-07-10_cd801112,Treatment of diabetic neuropathic pain with gabapentin alone or combined with vitamin B complex. preliminary results.,"Neuropathic pain is a syndrome that affects around 1% of population. This condition can be severely disabling and traditional analgesics are useless against this type of pain. Several adjuvants such as the anticonvulsive agent gabapentin have been used to treat diabetic neuropathy with several degrees of effectiveness, but it is characterized of a high incidence of dizziness, somnolence and ataxia. Previously we have found a functional synergistic interaction after co-administration of gabapentin and B vitamins by using a neuropathic pain model in the rat. In order to evaluate the efficacy of gabapentin and B vitamins in the treatment of diabetic neuropathy in humans we carried out a comparative trial. In this study are presented preliminary results from 6 patients assigned to two groups: group A (n=3) received gabapentin, and group B (n=3) received gabapentin plus B vitamins. In both groups, the dose was increased at weekly intervals, and characteristics of pain and some parameters of quality of life were assessed. Both treatments significantly reduced pain and improved quality of life in the patients. Dizziness was the main adverse event observed in both groups. Data suggest that the combination of gabapentin and B vitamins could be an alternative treatment for diabetic neuropathic patients.",2004,Proceedings of the Western Pharmacology Society,,15633627,https://pubmed.ncbi.nlm.nih.gov/15633627/,15633627,,,false
pubmed:15617053:pubmed_K2_2026-07-10_cd801112,pubmed,K2,pubmed_K2_2026-07-10_cd801112,Manganese toxicity upon overexposure.,"Manganese (Mn) is a required element and a metabolic byproduct of the contrast agent mangafodipir trisodium (MnDPDP). The Mn released from MnDPDP is initially sequestered by the liver for first-pass elimination, which allows an enhanced contrast for diagnostic imaging. The administration of intravenous Mn impacts its homeostatic balance in the human body and can lead to toxicity. Human Mn deficiency has been reported in patients on parenteral nutrition and in micronutrient studies. Mn toxicity has been reported through occupational (e.g. welder) and dietary overexposure and is evidenced primarily in the central nervous system, although lung, cardiac, liver, reproductive and fetal toxicity have been noted. Mn neurotoxicity results from an accumulation of the metal in brain tissue and results in a progressive disorder of the extrapyramidal system which is similar to Parkinson's disease. In order for Mn to distribute from blood into brain tissue, it must cross either the blood-brain barrier (BBB) or the blood-cerebrospinal fluid barrier (BCB). Brain import, with no evidence of export, would lead to brain Mn accumulation and neurotoxicity. The mechanism for the neurodegenerative damage specific to select brain regions is not clearly understood. Disturbances in iron homeostasis and the valence state of Mn have been implicated as key factors in contributing to Mn toxicity. Chelation therapy with EDTA and supplementation with levodopa are the current treatment options, which are mildly and transiently efficacious. In conclusion, repeated administration of Mn, or compounds that readily release Mn, may increase the risk of Mn-induced toxicity.",2004,NMR in biomedicine,10.1002/nbm.931,15617053,https://pubmed.ncbi.nlm.nih.gov/15617053/,15617053,,,false
pubmed:15558839:pubmed_K2_2026-07-10_cd801112,pubmed,K2,pubmed_K2_2026-07-10_cd801112,Pyridoxine (vitamin B6) neurotoxicity: enhancement by protein-deficient diet.,"Large doses of pyridoxine cause injury to the primary sensory neurons in trigeminal and dorsal root ganglia of animals and patients subjected to megavitamin therapy. The increased hazard to subjects with reduced renal excretory function has been explored previously. In the present work, the neurotoxicity of pyridoxine for rats was found to be increased by dietary protein deficiency. A mere 3 or 7 days of pretreatment with either of two protein-deficient diets were sufficient to accelerate and intensify the clinical neurological signs and histological lesions from pyridoxine injections. These results are caused, at least in part, by loss of body weight, decreased protein binding in serum and decreased consumption of water and decreased volume of urine, which reduce the urinary losses of the toxicant. The vitamers related to pyridoxine (pyridoxal, pyridoxamine) and the coenzyme (pyridoxal 5-phosphate) did not cause clinical signs or lesions similar to those produced by pyridoxine even when injected in maximum tolerated doses. Neither a protein-deficient diet nor bilateral nephrectomy changed the results with the vitamers.",2004,Journal of applied toxicology : JAT,10.1002/jat.1007,15558839,https://pubmed.ncbi.nlm.nih.gov/15558839/,15558839,,,false
pubmed:15473987:pubmed_K2_2026-07-10_cd801112,pubmed,K2,pubmed_K2_2026-07-10_cd801112,Pyridoxine-induced toxicity in rats: a stereological quantification of the sensory neuropathy.,"Excess ingestion of pyridoxine (vitamin B6) causes a severe sensory neuropathy in humans. The mechanism of action has not been fully elucidated, and studies of pyridoxine neuropathy in experimental animals have yielded disparate results. Pyridoxine intoxication appears to produce a neuropathy characterized by necrosis of dorsal root ganglion (DRG) sensory neurons and degeneration of peripheral and central sensory projections, with large diameter neurons being particularly affected. The major determinants affecting the severity of the pyridoxine neuropathy appear to be duration and dose of pyridoxine administration, differential neuronal vulnerability, and species susceptibility. The present study used design-based stereological techniques in conjunction with electrophysiological measures to quantify the morphological and physiological changes that occur in the DRG and the distal myelinated axons of the sciatic nerve following pyridoxine intoxication. This combined stereological and electrophysiological method demonstrates a general approach that could be used for assessing the correlation between pathophysiological and functional parameters in animal models of toxic neuropathy.",2004,Experimental neurology,10.1016/j.expneurol.2004.07.013,15473987,https://pubmed.ncbi.nlm.nih.gov/15473987/,15473987,,,false
pubmed:15318336:pubmed_K2_2026-07-10_cd801112,pubmed,K2,pubmed_K2_2026-07-10_cd801112,Clinical features and pathophysiological basis of sensory neuronopathies (ganglionopathies).,"Sensory ganglionopathies have a frequent association with neoplastic disorders (paraneoplastic subacute sensory neuronopathy, or SSN) or dysimmune disorders (Sjögren's syndrome, SS; Miller Fisher syndrome; and Bickerstaff's brainstem encephalitis, BBE), with drugs, such as cisplatin or pyridoxine, and with inherited disorders with degeneration of dorsal root ganglion cells. Unsteady gait and pseudoathetoid movements of the hand are the distinctive signs encountered in these disorders. The chronic disorders are characterized by non-length-dependent abnormalities of sensory nerve action potentials (SNAPs) and differ from other sensory neuropathies in showing a global, rather than distal, decrease in SNAP amplitudes. This review focuses on recent advances in defining the mechanisms involved in sensory ganglionopathies. Specific topics include a summary of their clinical features, pathological findings, and immunopathology. In SSN, early diagnosis by the detection of anti-Hu antibodies and early treatment of the cancer gives the best chance of stabilizing the disorder. In SS sensory ganglionitis, response to treatment has been disappointing, but immunomodulating treatments are emerging. The immunological profile common to BBE and Fisher syndrome supports a common pathogenesis. In toxic sensory neuronopathy, no treatment is available. The differential diagnosis involves separating sensory ganglionopathies from other ataxic polyneuropathies, such as infectious neuropathies, sensory neuropathies with various autoantibodies, and the neuropathies seen in celiac disease.",2004,Muscle & nerve,10.1002/mus.20100,15318336,https://pubmed.ncbi.nlm.nih.gov/15318336/,15318336,,,false
pubmed:15286022:pubmed_K2_2026-07-10_cd801112,pubmed,K2,pubmed_K2_2026-07-10_cd801112,Folate intake and risk of Parkinson's disease.,"In clinical studies, individuals with Parkinson's disease have had higher concentrations of plasma homocysteine than did controls, and experimental evidence suggests that folate deficiency or focal administration of homocysteine sensitizes dopaminergic neurons to the neurotoxicity of 1-methyl-4-phenyl-1,2,3,6-tetrahydropyridine. The authors thus prospectively investigated whether higher intake of folate, vitamin B(6), or vitamin B(12) was related to a lower risk of Parkinson's disease in the Health Professionals Follow-up Study (1986-2000) and the Nurses' Health Study (1980-1998). They documented Parkinson's disease diagnoses in 248 men and 167 women during the follow-up. Folate intake was not associated with the risk of Parkinson's disease; the relative risks for the highest compared with the lowest quintiles were 1.0 (95% confidence interval: 0.7, 1.5) in men and 1.3 (95% confidence interval: 0.8, 2.3) in women. Neither did they find significant associations in analyses stratified by age, smoking, alcohol consumption, or lactose intake. Intake of vitamin B(6) or vitamin B(12) also was not related to the risk of Parkinson's disease. The current study does not support the hypothesis that higher intake of folate or related B vitamins lowers the risk of Parkinson's disease.",2004,American journal of epidemiology,10.1093/aje/kwh213,15286022,https://pubmed.ncbi.nlm.nih.gov/15286022/,15286022,,,false
pubmed:15098856:pubmed_K2_2026-07-10_cd801112,pubmed,K2,pubmed_K2_2026-07-10_cd801112,Pyridoxine hydrochloride treatment of carpal tunnel syndrome: a review.,"It has been hypothesized that idiopathic carpal tunnel syndrome (CTS) is a manifestation of vitamin B6 deficiency. Some claim that B6 supplementation can alleviate symptoms. Others argue that pain relief occurs because of vitamin B6's anti-nociceptive properties or because B6 supplementation addresses an unrecognized peripheral neuropathy. Few studies on CTS and B6 employed electrodiagnostic techniques in diagnosis, and few showed a correlation between symptoms and improved electrodiagnostic parameters with supplementation. Other studies failed to measure or estimate B6 levels. Nevertheless, it appears reasonable to recommend vitamin B6 supplementation to people with CTS. Some patients will improve symptomatically with low risks of toxicity in recommended doses.",2004,Nutrition reviews,10.1111/j.1753-4887.2004.tb00030.x,15098856,https://pubmed.ncbi.nlm.nih.gov/15098856/,15098856,,,false
pubmed:14687374:pubmed_K2_2026-07-10_cd801112,pubmed,K2,pubmed_K2_2026-07-10_cd801112,Paresthesias developing in an elderly patient after chronic usage of nitrofurantoin and vitamin B6.,,2003,Journal of the American Geriatrics Society,10.1046/j.1532-5415.2003.51572_8.x,14687374,https://pubmed.ncbi.nlm.nih.gov/14687374/,14687374,,,false
pubmed:12909271:pubmed_K2_2026-07-10_cd801112,pubmed,K2,pubmed_K2_2026-07-10_cd801112,Dose-dependent effects of glutamate in pyridoxine-induced neuropathy.,"In order to explore the effects of glutamate in a pyridoxine megadose-induced neuropathy, rats were received glutamate either 0.5 or 1 g/kg/day orally with or without pyridoxine 0.8 g/kg/day intraperitoneally for 14 days. The animal's motor coordination, the muscle power and the thermal threshold were observed daily. The nerve conduction velocity was measured at day 0 and day 15 of the treatment. Glutamate either 0.5 or 1 g/kg/day appeared to have no effect on motor coordination, the nerve conduction velocity and the muscle power score compared with control. However, the thermal response latency was significantly decreased (from day 9) in animals treated with 1 g/kg/day glutamate. In pyridoxine-induced neuropathy rats, glutamate 0.5 g/kg/day significantly decreased the effects of pyridoxine on the sciatic nerve conduction velocity, the muscle power score and the motor coordination. Interestingly, glutamate at a dose of 1 g/kg/day worsened the neurotoxic effects cause by pyridoxine.",2003,Food and chemical toxicology : an international journal published for the British Industrial Biological Research Association,10.1016/s0278-6915(03)00142-x,12909271,https://pubmed.ncbi.nlm.nih.gov/12909271/,12909271,,,false
