record_id,source,target_id,search_run_id,title,abstract_or_summary,year,journal_or_source,doi,pmid,url,raw_record_id,dedup_key,duplicate_of,is_duplicate
pubmed:42400260:pubmed_K2_2026-07-10_cd801112,pubmed,K2,pubmed_K2_2026-07-10_cd801112,Vitamin B6 produced by gut microbiome regulates host behavioral phenotypes through dopaminergic metabolism.,"The gut microbiome modulates host neuropathology, but the mechanisms linking specific microbial genes and metabolites to host phenotypes remain poorly defined. Here, we identify microbiome-derived vitamin B6 (VB6) and its biosynthesis gene as key regulators of host dopaminergic homeostasis. Metagenomic analysis of fecal samples from Parkinson's disease (PD) patients revealed enrichment of biosynthetic pathways for pyridoxal-5'-phosphate (PLP), the active form of VB6, and tyrosine decarboxylase genes. Using E. coli-C. elegans symbiotic models, we demonstrate that the bacterial pdxJ gene, encoding a key enzyme in de novo VB6 synthesis, is essential in regulating host dopaminergic homeostasis. Colonization with pdxJ-deficient bacteria led to reduced host VB6 and dopamine levels, reduced dopaminergic enzyme activity, and altered motor behavior, which were all rescued by VB6 supplementation. In PD-relevant C. elegans models, bacterial PLP biosynthesis modulated α-synuclein aggregation and behavioral deficits associated with human LRRK2 mutations. In mice, colonization with pdxJ-deficient bacteria reduced serum VB6 levels, decreased tyrosine hydroxylase staining in the substantia nigra, and impaired motor coordination, which were rescued by VB6 supplementation. Overall, our results define a bacterial pdxJ-PLP-dopamine axis that links gut microbial metabolism to host dopaminergic phenotypes and suggest bacterial VB6 biosynthesis as a potential modifier of PD risk and a context-dependent therapeutic target.",2026,Gut microbes,10.1080/19490976.2026.2695485,42400260,https://pubmed.ncbi.nlm.nih.gov/42400260/,42400260,,,false
pubmed:42315405:pubmed_K2_2026-07-10_cd801112,pubmed,K2,pubmed_K2_2026-07-10_cd801112,[Acute intermittent porphyria: When diagnostic errance jeopardizes patient health].,"INTRODUCTION: Acute intermittent porphyria is a rare genetic disorder characterized by an enzyme deficiency in heme synthesis, causing an accumulation of neurotoxic precursors. Its clinical symptoms include abdominal and/or lumbar pain, reddish-brown urine, and neuropsychiatric signs.
OBSERVATION: We report the case of a young female patient who presented with several episodes of intense low back pain followed by confusion, visual hallucinations, epileptic seizures, and severe dysautonomia with hypotension and impaired alertness. The diagnosis was established after several weeks of investigation, one year after the onset of symptoms. The course of the disease was marked by an early relapse without any triggering factor, which led to treatment with givosiran, which was spectacularly successful. Treatment-induced hyperhomocysteinemia was successfully corrected with pyridoxine.
CONCLUSION: It is essential to be aware of the epidemiology, risk factors, and suggestive symptoms of this potentially serious treatable disease to reduce diagnostic uncertainty, limit long-term complications, and improve prognosis.",2026,La Revue de medecine interne,10.1016/j.revmed.2026.05.005,42315405,https://pubmed.ncbi.nlm.nih.gov/42315405/,42315405,,,false
pubmed:42253685:pubmed_K2_2026-07-10_cd801112,pubmed,K2,pubmed_K2_2026-07-10_cd801112,Vitamin B12 toxicity secondary to post-bariatric supplementation: a case report on presentation and literature review.,"INTRODUCTION: Bariatric surgery leads to nutritional alterations, particularly affecting micronutrient levels. Vitamin B12 plays essential roles in neurological function and hematopoiesis. Postoperative changes in gastrointestinal anatomy disrupt B12 absorption, often necessitating supplementation. However, excessive supplementation may result in supraphysiological levels, with potential adverse effects. This report explores such a scenario to raise awareness about the need for balanced vitamin B12 management.
CASE PRESENTATION: A 43-year-old male with obstructive sleep apnea underwent laparoscopic sleeve gastrectomy with an initial body mass index (BMI) of 38. Postoperative recovery was uneventful. He was prescribed multivitamins, vitamin D, and vitamin B complex. By the third month, he achieved a BMI of 25 but reported peripheral extremity weakness and numbness. Lab tests showed a vitamin B12 level of 1300 pg/mL (picograms per milliliter). Supplementation was halted, and after 1 month, symptoms resolved, and levels normalized to 617 pg/mL. The patient resumed normal activity and was advised regular B12 monitoring.
DISCUSSION: Vitamin B12 absorption is dependent on intrinsic factor and intact gastrointestinal anatomy. Bariatric surgeries alter this physiology, increasing the risk for both deficiency and excessive supplementation. Current literature highlights that while Roux-en-Y gastric bypass patients often develop deficiencies, Vertical sleeve gastrectomy patients may inadvertently accumulate B12 due to altered absorption patterns. Supraphysiological B12 levels may lead to oxidative stress and obscure other deficiencies. This case supports the necessity of tailored supplementation regimens and ongoing monitoring.
CONCLUSION: This report underscores the importance of vigilant vitamin B12 monitoring in post-bariatric patients. Individualized supplementation plans and routine biochemical assessments are crucial to prevent both deficiency and toxicity. Further studies should investigate the long-term effects of high B12 levels in this population.",2026,International journal of surgery case reports,10.1097/RC9.0000000000000441,42253685,https://pubmed.ncbi.nlm.nih.gov/42253685/,42253685,,,false
pubmed:42246850:pubmed_K2_2026-07-10_cd801112,pubmed,K2,pubmed_K2_2026-07-10_cd801112,"High-dose pyridoxine and peripheral neuropathy: Considerations for clinicians, pharmacists and policy-makers.",,2026,South African medical journal = Suid-Afrikaanse tydskrif vir geneeskunde,10.7196/SAMJ.2026.v116i5.4610,42246850,https://pubmed.ncbi.nlm.nih.gov/42246850/,42246850,,,false
pubmed:42246534:pubmed_K2_2026-07-10_cd801112,pubmed,K2,pubmed_K2_2026-07-10_cd801112,[Efficacy and tolerability of the pharmaconutraceutical complex Theraflex Ultra in the treatment of patients with chronic non-specific lower back pain due toprimarily discogenic pathology (FORSAGE study)].,"OBJECTIVE: To evaluate the efficacy and tolerability of the pharmaconutraceutical complex, Theraflex Ultra, based on undenatured (native) type II collagen, in the treatment of discogenic chronic low back pain (CLBP).
MATERIAL AND METHODS: This open, multicenter, observational study included 50 patients (28 women and 22 men; mean age 48.3 years [45.5; 52.2]) diagnosed with CLBP, mostly associated with discogenic pathology, as confirmed by clinical evaluation and neuroimaging. The study group (n=25) received standard therapy comprising non-steroidal anti-inflammatory drugs (NSAIDs) for 10 days, a centrally acting muscle relaxant for 14 days, and a high-dose vitamin B complex for 21 days, combined with Theraflex Ultra at 2 capsules twice daily for 2 months. The control group (n=25) received only the standard therapy. Efficacy was assessed after 1, 2, and 3 months using various scales, including the Numeric Rating Scale for Pain (NRS-P), the Douleur Neuropathique 4 (DN4), the Back Pain Functional Scale (BPFS), and the Medical Outcomes Study Short Form 36 (MOS SF-36). The relapse rate during the first year post-enrollment in the study was also documented.
RESULTS: After one month, the study group exhibited a significantly greater reduction in pain intensity, as measured by the NRS-P, compared to the control group (23.2±8.8 versus 35.2±7.4; p<0.05). After two months, the study group demonstrated significant improvements in functional activity (BPFS: 51.7±15.7 vs. 40.2±13.1) and the physical component of quality of life (MOS SF-36: 86.8±5.5 vs. 77.2±8.1; p<0.05). No intergroup differences were noted on the DN4 scale, indicating nociceptive pain. Treatment adherence in the study group was high, with a score of 9.9±4.2 on the Adherence to Refills and Medications Scale (ARMS-7). A relapse occurred in 20% of patients in the study group and 32% in the control group after one year (relative risk [RR] 1.4 [confidence interval [CI] 0.513-3.824]; number needed to treat [NNT]=8.3). Adverse events were reported in all groups; however, they were mild and did not require treatment discontinuation.
CONCLUSION: The addition of Theraflex Ultra to the standard therapy regimen for discogenic chronic non-specific low back pain yields a significant reduction in pain intensity, enhanced functional activity and quality of life, and a decreased risk of relapse within a year. The product demonstrates high treatment adherence and favorable tolerability. Subsequent randomized studies are warranted to validate these findings.",2026,Zhurnal nevrologii i psikhiatrii imeni S.S. Korsakova,10.17116/jnevro2026126051108,42246534,https://pubmed.ncbi.nlm.nih.gov/42246534/,42246534,,,false
pubmed:42182331:pubmed_K2_2026-07-10_cd801112,pubmed,K2,pubmed_K2_2026-07-10_cd801112,Pyridoxine supplementation confers protection against SGPL1 R222Q variant sphingosine phosphate lyase insufficiency syndrome.,"Sphingosine-1-phosphate lyase insufficiency syndrome (SPLIS) is a rare condition causing nephrotic syndrome, neuropathy, and other manifestations. SPLIS is caused by mutations in SGPL1, which encodes sphingosine-1-phosphate lyase (SPL), a pyridoxal 5'-phosphate (PLP)-dependent enzyme needed to degrade the bioactive sphingolipid sphingosine-1-phosphate (S1P). Supplementation with the PLP precursor pyridoxine benefits some individuals with PLP-dependent enzymopathies. We sought to establish whether pyridoxine has therapeutic activity in SPLIS. Neurological improvement, plasma S1P normalization, and increased SPL activity in patient-derived fibroblasts were observed after pyridoxine supplementation in a patient with R222Q-variant SPLIS. Additionally, PLP dose-dependently augmented recombinant R222Q-variant SPL activity. To further explore pyridoxine's effects, gene editing was employed to create an R222Q-variant SPLIS mouse model. SPLR222Q mice fed pyridoxine-enriched chow lacked obvious phenotypes. However, SPL inactivation, S1P accumulation, wasting, anemia, proteinuria, and glomerulosclerosis developed in SPLR222Q but not WT mice fed chow with reduced pyridoxine. Ultrastructural analysis and super-resolution microscopy showed podocyte loss and foot process effacement. Transcriptional profiling revealed a pattern of cytokine upregulation and extracellular matrix remodeling. Inhibiting S1P production prevented nephrosis in SPLR222Q mice fed chow lacking pyridoxine. Our findings establish a novel SPLIS mouse model that recapitulates R222Q-variant SPLIS, demonstrates its responsiveness to pyridoxine, and implicates S1P in its pathophysiology.",2026,bioRxiv : the preprint server for biology,10.64898/2026.05.11.724358,42182331,https://pubmed.ncbi.nlm.nih.gov/42182331/,42182331,,,false
pubmed:42161587:pubmed_K2_2026-07-10_cd801112,pubmed,K2,pubmed_K2_2026-07-10_cd801112,Acquired vitamin B6 deficiency in POEMS: a marker of disease activity and cause of neuropathy?,"BACKGROUND: POEMS syndrome is a rare, life-threatening multisystem disease driven by clonal plasma cell proliferation and characterised by disabling neuropathy, a monoclonal plasma cell disorder and diagnostic paraneoplastic features. Although vascular endothelial growth factor (VEGF) is a key diagnostic marker and correlates with disease activity, it is not the central mediator and the specific pathomechanism for the characteristic distal sensorimotor neuropathy remains elusive. Pyridoxal 5'-phosphate (PLP), the active form of vitamin B6, is an essential cofactor for human biological processes; its deficiency is known to cause distal sensorimotor neuropathy.
METHODS: Following reports of B6 deficiency in POEMS syndrome, 50 sequential patients at our centre (18 active, 32 in remission) were tested for PLP deficiency between September 2023 and July 2024.
RESULTS: Active POEMS patients demonstrated significantly lower plasma PLP concentrations (median 9.5 nmol/L) compared with those in treated remission (median 36 nmol/L; p<0.0001). Significant negative correlations were observed between plasma PLP and serum VEGF (r=-0.64, p<0.0001) and paraprotein concentration (r=-0.3783, p=0.0068). In nine patients, PLP levels normalised (median 8.5-37 nmol/L; p<0.002) following treatment-induced remission without B6 supplementation. Notably, two cases of (P)OEMS (POEMS features with elevated VEGF but without neuropathy) maintained normal PLP levels. Increased ratios of pyridoxic acid to PLP in active patients suggest a catabolic shift and dysfunctional B6 metabolism.
CONCLUSIONS: Our findings indicate a correlation between active POEMS syndrome and low plasma PLP. We hypothesise that severe PLP deficiency plays a critical role in the development of neuropathy in POEMS. Further research is required to establish the exact mechanism and evaluate B6 supplementation.",2026,"Journal of neurology, neurosurgery, and psychiatry",10.1136/jnnp-2025-338333,42161587,https://pubmed.ncbi.nlm.nih.gov/42161587/,42161587,,,false
pubmed:42079267:pubmed_K2_2026-07-10_cd801112,pubmed,K2,pubmed_K2_2026-07-10_cd801112,Brain B Vitamin Status and One-Carbon Metabolism Gene Polymorphisms are Associated with Cognitive Impairment in Alzheimer's and Parkinson's Disease.,"INTRODUCTION: Disturbances in one-carbon metabolism and homocysteine (Hcy) regulation have been implicated in Alzheimer's disease (AD) and Parkinson's disease (PD), yet direct evidence from human brain tissue and the contribution of genetic variation remain limited. We investigated whether B-vitamin-related metabolic deficits and polymorphisms in one-carbon metabolism pathways contribute to cognitive impairment in AD and PD.
METHODS: We quantitated metabolites related to B vitamins and one-carbon metabolism in post-mortem frontal cortex (n=136) and putamen (n=68) from clinically and neuropathologically characterized healthy controls, AD dementia (AD-D), PD with dementia (PD-D), PD with mild cognitive impairment (PD-MCI), and cognitively normal PD (PD-CN). Genotyping targeted variants related to one-carbon metabolism and B vitamins. Multivariable regression models controlled for demographic, clinical, metabolic, and tissue-handling covariates.
RESULTS: AD-D and PD-D shared a convergent cortical signature of reduced biotin, pyridoxal-5'-phosphate, thiamine monophosphate, pantothenic acid, and betaine. Elevated Hcy and reduced tetrahydrofolate were specific to AD-D and to PD-D during acute levodopa exposure. PD-MCI exhibited deficits in putamen resembling cortical dementia-associated changes. Self-reported B-vitamin supplementation attenuated several abnormalities, including complete normalization of levodopa-associated Hcy and folate disturbances in PD-D. Across subjects, multiple B vitamins showed strong associations with Hcy and betaine, indicating coordinated impairment of all three Hcy-metabolizing pathways. Genotyping analysis identified polymorphisms in MTRR, TYMS, MTR, NFE2L2, BHMT, and MTHFR that were differentially distributed across cognitive subgroups or associated with AD-related pathology scores. Composite genetic and metabolic burden scores were elevated in cognitively impaired groups but not in cognitively normal groups.
CONCLUSION: Dementia in AD and PD is characterized by convergent B-vitamin deficiencies and genetic susceptibilities that disrupt Hcy metabolism. These findings provide a mechanistic explanation for levodopa-related Hcy accumulation in vulnerable PD subjects and identify B-vitamin supplementation as a potentially modifiable factor relevant to cognitive decline.",2026,bioRxiv : the preprint server for biology,10.64898/2026.04.22.719490,42079267,https://pubmed.ncbi.nlm.nih.gov/42079267/,42079267,,,false
pubmed:42063363:pubmed_K2_2026-07-10_cd801112,pubmed,K2,pubmed_K2_2026-07-10_cd801112,Association of vitamin B1/B6/B12 supplementation with sphingosine-1-phosphate signaling and its receptors in multiple sclerosis patients: relevance to LISPR1 and APOA1-AS.,"MS is a lifelong autoimmune disorder striking the central nervous system (CNS). Despite the currently used disease-modifying therapies, patients are exposed to persistent neuropathy, pinpointing the need for supportive therapy. Neurotropic vitamins B1, B6, and B12 have been used to offer relief from immunological and neurological MS manifestations. The present study aimed to provide some mechanistic insights into the relationship of B1/B6/B12 vitamin supplementation with the development of MS regarding lipid metabolism and epigenetics. In this cross-sectional observational study, blood samples were obtained from 53 MS patients, including 25 patients, who had received daily vitamin B1/B6/B12 supplementation for over six months and 28 patients without supplementation. Plasma sphingosine-1-phosphate (S1P) and S1P receptor-1 (S1PR1) levels, lipid profile, and gene expression of ApoA1, sphingosine kinases 1&2 (SPHK1&2), S1PR1, as well as the lncRNAs APOA1-AS and LISPR1 were evaluated. Gene ontology and KEGG pathway enrichment analyses were conducted. Vitamin B1/B6/B12 supplementation was associated with a more favorable lipid profile. Supplemented patients also exhibited higher ApoA1 and lower APOA1-AS expressions compared with non-supplemented patients. Additionally, vitamin B1/B6/B12 supplementation was associated with lower expression levels of SPHK1, SPHK2, LISPR1, and S1PR1 and reduced circulating S1P concentrations. These findings imply significant associations between long-term vitamin B1/B6/B12 supplementation and alterations in lipid-related markers and sphingosine-associated signaling in MS patients. However, the observational design, selection bias, and small sample size limit causal inference and may not fully capture the heterogeneity of MS population. Besides, supplement adherence was self-reported and not objectively verified, and circulating vitamin levels were not measured.",2026,Bioscience reports,10.1042/BSR20260065,42063363,https://pubmed.ncbi.nlm.nih.gov/42063363/,42063363,,,false
pubmed:41942316:pubmed_K2_2026-07-10_cd801112,pubmed,K2,pubmed_K2_2026-07-10_cd801112,Peripheral Neuropathy during Subcutaneous Foslevodopa/Foscarbidopa Infusion in Parkinson's Disease: A Case Series.,"BACKGROUND: Peripheral neuropathy has been described in Parkinson's disease (PD) patients receiving continuous levodopa delivery. Whether subcutaneous foslevodopa/foscarbidopa (fLD/fCD) infusion carries a similar risk remains unclear.
CASES: We report four PD patients treated with continuous subcutaneous fLD/fCD who experienced clinical and electrophysiological worsening of peripheral neuropathy after treatment initiation. At baseline, none reported functional neuropathic symptoms, although electrophysiological evidence of mild subclinical peripheral neuropathy and/or biochemical abnormalities was present. Neuropathic symptoms developed within a few months of fLD/fCD initiation and were associated with vitamin B6 and/or B12 deficiency and persistent hyperhomocysteinemia. In all cases, electrophysiological deterioration accompanied symptoms emergence.
CONCLUSIONS: Although causality cannot be established, these cases suggest that fLD/fCD infusion may be associated with aggravation of pre-existing peripheral neuropathy, despite non-enteral administration, supporting a potential systemic metabolic contribution. These findings underscore the importance of baseline assessment and longitudinal monitoring of peripheral nerve function and B-vitamin status in patients receiving fLD/fCD. Optimal vitamin supplementation strategies in this setting remain to be defined.",2026,Movement disorders clinical practice,10.1002/mdc3.70629,41942316,https://pubmed.ncbi.nlm.nih.gov/41942316/,41942316,,,false
pubmed:41888341:pubmed_K2_2026-07-10_cd801112,pubmed,K2,pubmed_K2_2026-07-10_cd801112,PDXK-Related Neuropathy: A Case With a Novel Splice-Altering Missense Variant and Literature Review.,"BACKGROUND: PDXK-related neuropathy is a rare form of hereditary motor and sensory neuropathy with optic atrophy, caused by biallelic variants in the PDXK gene. To date, only four missense variants have been reported in 13 patients from six families. Unlike most inherited neuropathies, which currently have only symptomatic treatments, this type of neuropathy can be managed with pyridoxal 5'-phosphate supplementation.
METHODS: The clinical presentation of the patient was evaluated twice, at ages 14 and 15 years. The whole-exome sequencing was performed for the proband followed by functional studies using RNA extracted from the proband's and proband's mother's peripheral blood mononuclear cells.
RESULTS: In this study, we provided a brief literature review on PDXK-related neuropathy and reported a female patient with a novel missense variant (c.826G>C, p.(Ala276Pro)) found in compound heterozygous state with a previously reported variant (c.659G>A, p.[Arg220Gln]) in the PDXK gene. Additionally, she carried a novel likely pathogenic missense variant (c.1180C>T, p.[Arg394Cys]) in the GCK gene, associated with MODY2, which was segregated with hyperglycemia in her family. The novel variant c.826G>C in the PDXK gene was predicted to disrupt splicing that was confirmed by our functional studies. The patient exhibited typical peripheral neuropathy but no optic atrophy, likely due to her young age.
CONCLUSIONS: Here we report a novel splice-altering missense variant in PDXK that induces aberrant transcript degradation, revealing a new disease mechanism for PDXK-related neuropathy.",2026,Molecular genetics & genomic medicine,10.1002/mgg3.70210,41888341,https://pubmed.ncbi.nlm.nih.gov/41888341/,41888341,,,false
pubmed:41835766:pubmed_K2_2026-07-10_cd801112,pubmed,K2,pubmed_K2_2026-07-10_cd801112,Moxifloxacin-Induced Peripheral Neuropathy: A Rare Side Effect of Fluoroquinolone Therapy in Tuberculosis Management.,"Moxifloxacin (MXF) is a cornerstone of the newly recommended four-month 2HPMZ/2HPM regimen for drug-susceptible pulmonary tuberculosis (TB). However, potential side effects such as cumulative neurotoxicity remain poorly characterized in clinical practice. Here, we report a rare case of peripheral neuropathy (PN) occurring after 17 weeks (four months) of MXF treatment in a 60-year-old Vietnamese man treated for drug-sensitive pulmonary TB. Following early isoniazid-induced hepatotoxicity, the patient's regimen was modified to include MXF 400 mg daily, notably without other neurotoxic agents such as linezolid or ethambutol. After 17 weeks of MXF therapy, the patient developed symmetrical stocking-glove PN. Extensive workup, including hemoglobin A1c and folate levels, ruled out common metabolic and nutritional etiologies. Cessation of MXF and pyridoxine supplementation led to gradual symptom improvement with full resolution after four months. While FDA warnings emphasize the often-rapid onset of fluoroquinolone-associated nerve damage within days of initiation, this case illustrates a delayed, cumulative toxicity profile that aligns with recent epidemiological evidence. As global TB guidelines shift toward four-month MXF regimens, this report highlights a critical safety consideration for clinicians and the importance of routine neurological screening throughout the entire treatment course to detect early signs of toxicity and prevent the development of potentially permanent PN.",2026,Cureus,10.7759/cureus.103314,41835766,https://pubmed.ncbi.nlm.nih.gov/41835766/,41835766,,,false
